{
  "schema": "kofun.release-claims/v1",
  "manifest_version": 1,
  "public_sources": [
    "docs/MVP_IMPLEMENTED.md"
  ],
  "areas": [
    "bootstrap",
    "c-backend",
    "frameworks",
    "frontend",
    "interop",
    "native",
    "quality",
    "self-hosting",
    "tooling",
    "webassembly"
  ],
  "targets": [
    "c11",
    "host-c",
    "linux-x86_64",
    "native-aarch64",
    "native-aarch64-macos-macho64",
    "native-aarch64-windows-pe32plus",
    "native-x86_64",
    "native-x86_64-macos-macho64",
    "native-x86_64-windows-pe32plus",
    "repository",
    "selfhost",
    "stage1",
    "stage2",
    "wasm32",
    "wasm32-hostabi1"
  ],
  "claims": [
    {
      "id": "affine-resource-handle",
      "public_wording": "bounded affine resource-handle protocol",
      "public_status": "bounded Stage 2/C11 checkpoint",
      "state": "checkpoint",
      "area": "frontend",
      "bounded_capability": "One nominal `AffineTransport` implements the closed RFC-0010 read/write/drain/close/cancel table. The standalone record evaluator and emitted Stage 2 C11 agree on the normal observations; production E2S123 checks refuse three moved-handle misuses; and a scripted C11 host boundary refuses stale or adversarially duplicated generations as EARH01. Production consuming calls invalidate the predecessor without a manual post-call take; reintroducing that marker is refused as a second move. The standalone evaluator remains a reference for successful observations, not positional move validation. This is not a general ownership pass or environment authority.",
      "targets": [
        "c11",
        "stage2"
      ],
      "specification": [
        "rfcs/0010-affine-resource-handle-v1.md",
        "tests/ownership/affine-resource-handle/README.md"
      ],
      "compatibility": "Only the declared `AffineTransport` table and scripted host-boundary generation check are checkpointed. No inferred move, alias, branch, loop, lifetime, destructor, cleanup, environment-authority, or general ownership behaviour is claimed.",
      "positive_gate": {
        "command": "task affine-resource-handle",
        "observation": "The reference evaluator, emitted Stage 2 C11, and scripted C11 host model agree on read, write, drain, close, cancel, terminal, and reuse observations."
      },
      "negative_boundary": {
        "kind": "trap",
        "evidence": "tests/ownership/affine-resource-handle/runtime_model.c",
        "observation": "A dead generation and the second of two adversarial copies both exit 1 with empty stdout and exact `EARH01: affine resource handle already consumed` stderr."
      },
      "safety": {
        "classification": "refusal-boundary",
        "threat_model": "rfcs/0010-affine-resource-handle-v1.md",
        "negative_test": "tests/ownership/affine-resource-handle/runtime_model.c"
      },
      "performance": {
        "classification": "none"
      },
      "reproduction": {
        "command": "task affine-resource-handle",
        "prerequisites": [
          "cc"
        ]
      }
    },
    {
      "id": "arithmetic-core",
      "public_wording": "arithmetic Core validation/emission",
      "public_status": "implemented",
      "state": "implemented",
      "area": "frontend",
      "bounded_capability": "The arithmetic Core is validated and emitted for the checked Int64 operator set; `/` is deliberately not part of it.",
      "targets": [
        "c11",
        "stage2"
      ],
      "specification": [
        "docs/SEMANTICS.md",
        "spec/semantics.md"
      ],
      "compatibility": "Operator semantics are covered by the numeric conformance corpus; additions arrive as new corpus cases rather than silent behaviour changes.",
      "positive_gate": {
        "command": "sh tests/cli.sh",
        "observation": "The arithmetic Core validates and emits without a diagnostic."
      },
      "negative_boundary": {
        "kind": "rejection",
        "evidence": "tests/conformance/numeric/reject_slash_operator.kofun",
        "observation": "`/` on `Int` is refused with one diagnostic instead of being lowered."
      },
      "safety": {
        "classification": "none"
      },
      "performance": {
        "classification": "none"
      },
      "reproduction": {
        "command": "task test",
        "prerequisites": []
      }
    },
    {
      "id": "benchmark-report-v1",
      "public_wording": "bounded benchmark report v1 model, Bytes codec, and comparison",
      "public_status": "bounded C11 Stage 2: 49 fields, 100 samples in 64+36 segments, canonical Bytes and explicit threshold comparison; no live runner, providers, filesystem publication, generic JSON, or other backend",
      "state": "implemented",
      "area": "c-backend",
      "bounded_capability": "The production Kofun model constructs complete 49-field reports with 100 samples in two capacity-64 segments. A bounded pure Bytes codec preserves canonical kofun.bench-report/v1 bytes and complete outcomes, and deterministic comparison uses the caller threshold. The composed fixture observes every model/decoded field, canonical buffers over 4 KiB, unavailable versus zero, non-normalized identity, and neutral refusals. Encoding prepares a private buffer and commits only after the destination reserve succeeds.",
      "targets": [
        "c11",
        "stage2"
      ],
      "specification": [
        "spec/benchmark-report-v1.md",
        "tests/stdlib/benchmark-report/README.md"
      ],
      "compatibility": "The wire is at most 16384 bytes inside the shared Managed Bytes[65536] profile, Text fields are bounded to 96/128/255 UTF-8 bytes, samples to 100, and JSON integers to 2^53-1. No live benchmark runner, clocks or counters provider, filesystem publication, generic JSON, significance result, or non-C11 backend is claimed. benchmark-harness remains specified.",
      "positive_gate": {
        "command": "task benchmark-report",
        "observation": "The specification, model, codec and comparison gates pass, and one Kofun source path constructs, encodes, decodes and compares complete reports against independent contract expectations at O0/O2, on repeat and under ASan/UBSan."
      },
      "negative_boundary": {
        "kind": "rejection",
        "evidence": "tests/stdlib/benchmark-report-codec/fixtures.mjs",
        "observation": "All 44 digest-pinned negative vectors return the frozen code with 48 neutral fields. Every injected encoder/decoder allocation failure returns BR012; prior outcomes including BR011 preserve the exact destination pointer, capacity, length and bytes without exposing a prefix."
      },
      "safety": {
        "classification": "refusal-boundary",
        "threat_model": "spec/benchmark-report-v1.md",
        "negative_test": "tests/stdlib/benchmark-report-codec/driver.c"
      },
      "performance": {
        "classification": "none"
      },
      "reproduction": {
        "command": "task benchmark-report",
        "prerequisites": [
          "cc",
          "clang",
          "node"
        ]
      }
    },
    {
      "id": "bindgen-c-stage1",
      "public_wording": "audited raw C bindings from the Clang AST",
      "public_status": "bounded stage-1 generator; raw and trusted, not safe",
      "state": "checkpoint",
      "area": "interop",
      "bounded_capability": "One self-contained C header becomes raw `extern \"C\"` declarations in the checked C ABI profile plus a machine-readable audit report, deterministically and with the interpretation context pinned by a digest. Sizes, alignments, field offsets, enum values, and the calling convention are verified against the C compiler rather than recorded from the generator's own arithmetic. Constructs outside the profile — macros, variadics, unions, bitfields, flexible arrays, inline functions, explicit calling conventions — are reported with a reason and never bound. Generated code declares `trust raw-foreign` in its own source, so an ordinary import of it is refused and a rename cannot change that; it is marked `raw-trusted-foreign` and is not safe: pointer ownership, lifetime, thread affinity, callback duration, and error conventions are recorded as unreviewed review rows, not checked. Arbitrary C is not supported, a safe facade is hand-written reviewed work, and `kofun migrate-c` does not exist.",
      "targets": [
        "host-c",
        "linux-x86_64"
      ],
      "specification": [
        "tooling/bindgen-c/README.md"
      ],
      "compatibility": "An artifact is pinned to the recorded clang version, effective target triple, language standard, defines, include paths, sysroot, and header hash. Changing any of them is a regeneration, not a compatible update, and the recorded digests make a stale artifact detectable.",
      "positive_gate": {
        "command": "sh tests/interop/bindgen-c/check.sh",
        "observation": "The pinned fixture header generates byte-identical bindings and an audit report twice; the C compiler confirms the recorded sizes, offsets, enum values, and calling convention; and the bindings build, link, and run against the fixture library under AddressSanitizer and UndefinedBehaviorSanitizer with leak detection on."
      },
      "negative_boundary": {
        "kind": "rejection",
        "evidence": "tests/interop/bindgen-c/fuzz/corpus/partial-declaration.h",
        "observation": "A header whose macros expand to an unbalanced declaration is refused with the cause named and no output directory; the same holds for expansion past the declaration and captured-output bounds, and for a clang that never answers."
      },
      "safety": {
        "classification": "none"
      },
      "performance": {
        "classification": "none"
      },
      "reproduction": {
        "command": "task bindgen-c",
        "prerequisites": [
          "cc",
          "clang",
          "node",
          "readelf"
        ]
      }
    },
    {
      "id": "borrowed-list-ownership",